ค่าว่าง,กำหนด 2,ชื่อ FC,สถานะ,
,2,ความรู้และทักษะการสัมภาษณ์งาน,Y,
,2,ภาษีบุคคล   ประกันสังคม,Y,
,2,โปรแกรมในการจัดทำ Website,Y,
,2,การบริหารจัดการระบบสารสนเทศ,Y,
,2,การบริหารจัดการโปรแกรมระบบ,Y,
,2,ทักษะการสื่อสาร นำเสนอ สอนงาน,Y,
,2,ทักษะในการบริหารโครงการ,Y,
,2,การใช้งานโปรแกรมสำเร็จรูป,Y,
,2,การเขียนโปรแกรมจัดทำรายงาน,Y,
,2,ระบบ Electronic  Mail,Y,
,2,การควบคุมดูแลระบบเทคโนโลยีฯ,Y,
,2,ทักษะในการติดตั้งและบำรุงรักษา,Y,
,2,ความรู้ในการจัดการงานเอกสาร,Y,
,2,กาจัดทำทะเบียนทรัพย์สิน,Y,
,2,การตอบข้อซักถามค่ารักษาพยาบาล,Y,
,2,สิทธิเบิกของหน่วยงานคู่สัญญา,Y,
,2,อัตราค่าบริการของโรงพยาบาล,Y,
,2,ความละเอียด รอบคอบ,Y,
,2,การคิดค่ารักษาพยาบาล,Y,
,2,การบริหารจัดการความเสี่ยง,Y,
,2,การแก้ปัญหาและการตัดสินใจ,Y,
,2,การสื่อสารภายในและภายนอกองค์กร,Y,
,2,ทักษะการนิเทศงาน และ การสอนงาน,Y,
,2,ทักษะงานเลขานุการ,Y,
,2,ความรู้ความเข้าใจในงาน,Y,
,2,จัดการระบบงานเอกสาร,Y,
,2,การจัดลำดับความสำคัญของงาน,Y,
,2,ความถูกต้องแม่นยำ,Y,
,2,การบริหารเชิงกลยุทธ์,Y,
,2,ความรู้ด้านการวางแผนยุทธศาสตร์,Y,
,2,ความรู้และทักษะการวิเคราะห์ข้อมูลโรงพยาบาล,Y,
,2,ความรู้กระบวนการโรงพยาบาล(OM),Y,
,2,ความรู้ด้านสถิติโรงพยาบาล,Y,
,2,การสื่อสารและประสานงาน,Y,
,2,ประเมินผลโครงการ ,Y,
,2,การปิดงบบัญชี,Y,
,2,บัญชีภาษีอากร,Y,
,2,ทักษะการใช้ Computer,Y,
,2,ความละเอียดรอบคอบ,Y,
,2,การประสานงาน,Y,
,2,บัญชีเจ้าหนี้,Y,
,2,บัญชีทรัพย์สิน,Y,
,2,การจัดเอกสารและเงื่อนไขการตั้งเบิก,Y,
,2,บัญชีลูกหนี้,Y,
,2,ระบบบัญชี Inventory,Y,
,2,การคำนวณค่าตอบแทนแพทย์,Y,
,2,ทักษะการควบคุม บริหารจัดการระบบห้องประชุมและเสียงประกาศ แจ้งเตือน,Y,
,2,ทักษะการบำรุงรักษาและซ่อมบำรุงงานระบบเฉพาะทาง,Y,