,5,24,PPSV-201908-555,ประเมินผิวหนัง ความตึงตัวของผิวหนังรวมถึง Conjunctiva,,0.8,2,เข้าใจ,ทำได้,เสนอแนะ,พัฒนา ,สอนงาน,,
,5,24,PPSV-201908-555,ประเมินภาวะฟัน การเคี้ยวและการกลืน,,0.8,2,เข้าใจ,ทำได้,เสนอแนะ,พัฒนา ,สอนงาน,,
,5,24,PPSV-201908-555,ประสานสหสาขาในการจัดการด้านโภชนาการได้ถูกต้อง (ตามนโยบาย),,0.8,2,เข้าใจ,ทำได้,เสนอแนะ,พัฒนา ,สอนงาน,,
,5,24,PPSV-201908-555,สอนและแนะนำการได้รับสารอาหารและน้ำในกรณีผู้ป่วยไม่มีปัญหาเฉพาะด้านของร่างกาย,,0.8,2,เข้าใจ,ทำได้,เสนอแนะ,พัฒนา ,สอนงาน,,
,5,24,PPSV-201908-555,สอนและแนะนำการได้รับสารอาหารและน้ำในกรณีผู้ป่วยที่ต้องได้รับอาหารเฉพาะโรค,,0.8,2,เข้าใจ,ทำได้,เสนอแนะ,พัฒนา ,สอนงาน,,
,5,24,PPSV-201908-555,สอนและแนะนำการได้รับสารอาหารและน้ำในกรณีผู้ป่วยที่ต้องได้รับอาหารช่องทางพิเศษ NG Tube,,0.8,2,เข้าใจ,ทำได้,เสนอแนะ,พัฒนา ,สอนงาน,,
,5,22,PPSV-201908-555,การเฝ้าติดตามประเมินอาการ และการรายงานแก้ไขปัญหาเมื่อเกิดภาวะแทรกซ้อนหลังให้เลือดและส่วนประกอบของเลือด,,1,2,เข้าใจ,ทำได้,เสนอแนะ,พัฒนา ,สอนงาน,,
,5,22,PPSV-201908-555,การให้ข้อมูลเกี่ยวกับการให้เลือด และส่วนประกอบของเลือดและการดูแลตนเองขณะได้รับเลือดแก่ผู้ป่วยและครอบครัว,,1,2,เข้าใจ,ทำได้,เสนอแนะ,พัฒนา ,สอนงาน,,
,5,22,PPSV-201908-555,การขอเลือดและการเตรียมเลือด ตามวิธีปฏิบัติการขอเลือด,,1,2,เข้าใจ,ทำได้,เสนอแนะ,พัฒนา ,สอนงาน,,
,5,22,PPSV-201908-555,การซักประวัติการได้รับเลือดและการแพ้เลือด และประเมินความต้องการในการได้รับเลือด,,1,2,เข้าใจ,ทำได้,เสนอแนะ,พัฒนา ,สอนงาน,,
,5,22,PPSV-201908-555,การบริหารเลือดและส่วนประกอบของเลือด ตามวิธีปฏิบัติการให้เลือด,,1,2,เข้าใจ,ทำได้,เสนอแนะ,พัฒนา ,สอนงาน,,
,5,22,PPSV-201908-555,การบันทึกการให้เลือดและส่วนประกอบของเลือด โดยระบุบริเวณที่ให้และชนิดของ catheterและอาการและอาการแสดงที่เป็นผลลัพธ์ที่เกิดขึ้นก่อน ขณะและหลังการให้เลือดและ ส่วนประกอบของเลือด,,1,2,เข้าใจ,ทำได้,เสนอแนะ,พัฒนา ,สอนงาน,,
,5,22,PPSV-201908-555,การรับคำสั่งแพทย์/การทวนสอบคำสั่งการให้เลือดและส่วนประกอบของเลือด,,1,2,เข้าใจ,ทำได้,เสนอแนะ,พัฒนา ,สอนงาน,,
,5,20,PPSV-201908-555,กรณีการบริหารยาHigh Alert Drug มีการ cross check และเฝ้าระวังการบริหาร (ตามนโยบาย),,0.9,2,เข้าใจ,ทำได้,เสนอแนะ,พัฒนา ,สอนงาน,,
,5,20,PPSV-201908-555,"การเฝ้าติดตามประเมินอาการหลังให้ยาและการรายงานแก้ไขปัญหา
เมื่อเกิดภาวะแทรกซ้อน",,0.9,2,เข้าใจ,ทำได้,เสนอแนะ,พัฒนา ,สอนงาน,,
,5,20,PPSV-201908-555,การให้ข้อมูลเกี่ยวกับยา อาการข้างเคียงของยาแก่ผู้ป่วยและครอบครัวทุกครั้งก่อน Admin ยา,,0.9,2,เข้าใจ,ทำได้,เสนอแนะ,พัฒนา ,สอนงาน,,
,5,20,PPSV-201908-555,การจัดเตรียมยาตามหลัก Aseptic เทคนิค / จัดเก็บยาในสถานที่สะอาด ปลอดภัยและถูกต้องตามมาตรฐาน,,0.9,2,เข้าใจ,ทำได้,เสนอแนะ,พัฒนา ,สอนงาน,,
,5,20,PPSV-201908-555,การซักประวัติการใช้ยาและการแพ้ยา รวมทั้งยาที่ได้รับการรักษาต่อเนื่อง(Medreconcile),,0.9,2,เข้าใจ,ทำได้,เสนอแนะ,พัฒนา ,สอนงาน,,
,5,20,PPSV-201908-555,การบริหารยาตามหลัก 6 R (Right drug - Right dose -Right time - Right Patient - Right route - Right technique),,0.9,2,เข้าใจ,ทำได้,เสนอแนะ,พัฒนา ,สอนงาน,,
,5,20,PPSV-201908-555,การบันทึกการบริหารยาและการแพ้ยา ตามเวลาและอาการที่เกิดขึ้นจริง,,0.9,2,เข้าใจ,ทำได้,เสนอแนะ,พัฒนา ,สอนงาน,,
,5,20,PPSV-201908-555,การรับคำสั่งแพทย์ / การทวนสอบคำสั่งแพทย์,,0.9,2,เข้าใจ,ทำได้,เสนอแนะ,พัฒนา ,สอนงาน,,
,5,21,PPSV-201908-555,การเตรียมสารน้ำทางหลอดเลือดดำตามหลัก Aseptic เทคนิคในสถานที่สะอาดปลอดภัย และการจัดเก็บสารละลายทางหลอดเลือดดำที่มีความเข้มข้นสูงตามมาตรฐาน,,1,2,เข้าใจ,ทำได้,เสนอแนะ,พัฒนา ,สอนงาน,,
,5,21,PPSV-201908-555,การเฝ้าติดตามประเมินอาการหลังให้สารน้ำทางหลอดเลือดดำและการรายงานแก้ไขปัญหาเมื่อเกิดภาวะแทรกซ้อน,,1,2,เข้าใจ,ทำได้,เสนอแนะ,พัฒนา ,สอนงาน,,
,5,21,PPSV-201908-555,การเลือกตำแหน่งเส้นเลือดที่เหมาะสมกับการให้สารน้ำทางหลอดเลือดดำ,,1,2,เข้าใจ,ทำได้,เสนอแนะ,พัฒนา ,สอนงาน,,
,5,21,PPSV-201908-555,การให้ข้อมูลความรู้เกี่ยวกับการให้สารน้ำทางหลอดเลือดดำ แก่ผู้ป่วยและครอบครัว,,1,2,เข้าใจ,ทำได้,เสนอแนะ,พัฒนา ,สอนงาน,,
,5,21,PPSV-201908-555,การบริหารสารน้ำทางหลอดเลือดดำ ตามหลัก 6 R (Right drug - Right dose -Right time - Right Patient - Right route - Right technique),,1,2,เข้าใจ,ทำได้,เสนอแนะ,พัฒนา ,สอนงาน,,
,5,21,PPSV-201908-555,การบันทึกการบริหารสารน้ำทางหลอดเลือดดำโดยระบุบริเวณที่ให้และชนิดของ catheter และอาการและอาการแสดงที่เป็นผลลัพธ์ที่เกิดขึ้นก่อน ขณะและหลังการได้รับสารน้ำ,,1,2,เข้าใจ,ทำได้,เสนอแนะ,พัฒนา ,สอนงาน,,
,5,21,PPSV-201908-555,การรับคำสั่งแพทย์/การทวนสอบคำสั่งการให้สารน้ำทางหลอดเลือดดำ,,1,2,เข้าใจ,ทำได้,เสนอแนะ,พัฒนา ,สอนงาน,,
,5,29,PPSV-201908-555,การเฝ้าระวัง  และติดตามอาการ   และอาการแสดงของคนไข้  Acute  MI,,0.65,3,เข้าใจ,ทำได้,เสนอแนะ,พัฒนา ,สอนงาน,,
,5,29,PPSV-201908-555,ความรู้เกี่ยวกับ Early warning sign ของผู้ป่วยกลุ่ม Acute  MI,,0.65,3,เข้าใจ,ทำได้,เสนอแนะ,พัฒนา ,สอนงาน,,
,5,29,PPSV-201908-555,มีความรู้   และความเข้าใจเกี่ยวกับอาการและการแสดงของคนไข้กลุ่ม  Acute  MI,,0.65,3,เข้าใจ,ทำได้,เสนอแนะ,พัฒนา ,สอนงาน,,
,5,29,PPSV-201908-555,มีความรู้ ความเข้าใจเกี่ยวกับ  Lab   วิกฤติ  ที่เกี่ยวกับผู้ป่วย  Acute  MI,,0.65,3,เข้าใจ,ทำได้,เสนอแนะ,พัฒนา ,สอนงาน,,
,5,29,PPSV-201908-555,มีความรู้ ความเข้าใจเกี่ยวกับ ยาที่เกี่ยวข้องกับผู้ป่วย  Acute  MI,,0.65,3,เข้าใจ,ทำได้,เสนอแนะ,พัฒนา ,สอนงาน,,
,5,29,PPSV-201908-555,มีความรู้เกียวกับการวินิจฉัยขั้นต้น เกี่ยวกับคนไข้ กลุ่ม  Acute  MI,,0.65,3,เข้าใจ,ทำได้,เสนอแนะ,พัฒนา ,สอนงาน,,
,5,29,PPSV-201908-555,รายงานแพทย์ได้ถูกต้องและครบถ้วน  และทันท่วงทีที่ผู้ป่วยมีอาการ เปลี่ยนแปลง,,0.65,3,เข้าใจ,ทำได้,เสนอแนะ,พัฒนา ,สอนงาน,,
,5,29,PPSV-201908-555,สามารถเฝ้าระวัง  และติดตาม  อาการ  และอาการแสดง  หลังผู้ป่วยได้รับยาได้,,0.65,3,เข้าใจ,ทำได้,เสนอแนะ,พัฒนา ,สอนงาน,,
,5,29,PPSV-201908-555,สามารถให้การพยาบาลขั้นพื้นฐาน  กับผู้ป่วยกลุ่ม  Acute  MI  ได้,,0.65,3,เข้าใจ,ทำได้,เสนอแนะ,พัฒนา ,สอนงาน,,
,5,29,PPSV-201908-555,สามารถอ่าน  และแปลผลคลื่นไฟฟ้าหัวใจที่เกี่ยวข้องกับผู้ป่วย  Acute  MI  ได้,,0.65,3,เข้าใจ,ทำได้,เสนอแนะ,พัฒนา ,สอนงาน,,
,5,29,PPSV-201908-555,สามารประเมินอาการ  และ  Detect  ได้   เมื่อผู้ป่วยมีอาการเปลี่ยนแปลง,,0.65,3,เข้าใจ,ทำได้,เสนอแนะ,พัฒนา ,สอนงาน,,
,5,26,PPSV-201908-555,Aspiration  precaution,,0.55,3,เข้าใจ,ทำได้,เสนอแนะ,พัฒนา ,สอนงาน,,
,5,26,PPSV-201908-555,Prevent  Contamination,,0.55,3,เข้าใจ,ทำได้,เสนอแนะ,พัฒนา ,สอนงาน,,
,5,26,PPSV-201908-555,การให้ข้อมูลญาติของผู้ป่วยเกี่ยวกับอาการและความจำเป็นของการใส่เครื่องช่วยหายใจ,,0.55,3,เข้าใจ,ทำได้,เสนอแนะ,พัฒนา ,สอนงาน,,
,5,26,PPSV-201908-555,การบันทึกทางทางการพยาบาลถูกต้อง ครบถ้วน,,0.55,3,เข้าใจ,ทำได้,เสนอแนะ,พัฒนา ,สอนงาน,,
,5,26,PPSV-201908-555,การปฏิบัติการดูแลให้อาหารทางสายยาง,,0.55,3,เข้าใจ,ทำได้,เสนอแนะ,พัฒนา ,สอนงาน,,
,5,26,PPSV-201908-555,การปฏิบัติการดูแลท่อทางเดินหายใจและส่วนประกอบ,,0.55,3,เข้าใจ,ทำได้,เสนอแนะ,พัฒนา ,สอนงาน,,
,5,26,PPSV-201908-555,การรายงานแพทย์ได้ถูกต้องและครบถ้วน,,0.55,3,เข้าใจ,ทำได้,เสนอแนะ,พัฒนา ,สอนงาน,,
,5,26,PPSV-201908-555,การสังเกตความผิดปกติของผู้ป่วยขณะใส่เครื่องช่วยหายใจและสามารถให้การพยาบาลช่วยเหลือเบื้องต้นได้,,0.55,3,เข้าใจ,ทำได้,เสนอแนะ,พัฒนา ,สอนงาน,,
,5,26,PPSV-201908-555,ความรู้เกี่ยวกับ Bundle of care : HAP  : Hand  Hygiene(5 moments for handhygiene),,0.55,3,เข้าใจ,ทำได้,เสนอแนะ,พัฒนา ,สอนงาน,,
,5,26,PPSV-201908-555,ความรู้เกี่ยวกับ Bundle of care : VAP : ความรู้เกี่ยวกับการปฏิบัติการดูดเสมหะแบบ Close suction และ open suction,,0.55,3,เข้าใจ,ทำได้,เสนอแนะ,พัฒนา ,สอนงาน,,
,5,26,PPSV-201908-555,ความรู้เกี่ยวกับการจัดท่าและพลิกตะแคงตัว,,0.55,3,เข้าใจ,ทำได้,เสนอแนะ,พัฒนา ,สอนงาน,,
,5,26,PPSV-201908-555,ความรู้เกี่ยวกับการทำความสะอาดช่องปาก,,0.55,3,เข้าใจ,ทำได้,เสนอแนะ,พัฒนา ,สอนงาน,,
,5,26,PPSV-201908-555,ความรู้เกี่ยวกับการปฏิบัติการดูแลท่อ tracheostomy,,0.55,3,เข้าใจ,ทำได้,เสนอแนะ,พัฒนา ,สอนงาน,,
,5,27,PPSV-201908-555,เตรียม paddle และเสริฟแพทย์ได้ถูกต้อง,,0.9,3,เข้าใจ,ทำได้,เสนอแนะ,พัฒนา ,สอนงาน,,
,5,27,PPSV-201908-555,เปิดเครื่อง Defibrillator และปรับเครื่องได้,,0.9,3,เข้าใจ,ทำได้,เสนอแนะ,พัฒนา ,สอนงาน,,
,5,27,PPSV-201908-555,การจัดท่าผู้ป่วย,,0.9,3,เข้าใจ,ทำได้,เสนอแนะ,พัฒนา ,สอนงาน,,
,5,27,PPSV-201908-555,การรายงานแพทย์ได้ถูกต้องและครบถ้วน,,0.9,3,เข้าใจ,ทำได้,เสนอแนะ,พัฒนา ,สอนงาน,,
,5,27,PPSV-201908-555,ทำ Defibrillation : ประเมิน EKG ที่ต้องทำ Defibrillation ได้,,0.9,3,เข้าใจ,ทำได้,เสนอแนะ,พัฒนา ,สอนงาน,,
,5,27,PPSV-201908-555,ทำการทดสอบเครื่อง Defibrillator แบบ Daily Check ได้,,0.9,3,เข้าใจ,ทำได้,เสนอแนะ,พัฒนา ,สอนงาน,,
,5,27,PPSV-201908-555,ปฏิบัติตามขั้นตอนการทำ Defibrillation ได้ถูกต้อง,,0.9,3,เข้าใจ,ทำได้,เสนอแนะ,พัฒนา ,สอนงาน,,
,5,27,PPSV-201908-555,สามารถแปลผล EKG ที่ต้องได้รับการช่วยเหลือเร่งด่วนได้,,0.9,3,เข้าใจ,ทำได้,เสนอแนะ,พัฒนา ,สอนงาน,,
,5,28,PPSV-201908-555,ความรู้  และความเชี่ยวชาญในการในการติด Lead EKG / EKG 12 LEAD /  EKG  monitor bed  side,,1.48,3,เข้าใจ,ทำได้,เสนอแนะ,พัฒนา ,สอนงาน,,
,5,28,PPSV-201908-555,ความรู้เบื้องต้นเกี่ยวกับการแปลผล  EKG,,1.48,3,เข้าใจ,ทำได้,เสนอแนะ,พัฒนา ,สอนงาน,,
,5,28,PPSV-201908-555,ความรู้ในการอ่าน และแปลผล EKG เบื้องต้น  basic  EKG / Abnormal,,1.48,3,เข้าใจ,ทำได้,เสนอแนะ,พัฒนา ,สอนงาน,,
,5,28,PPSV-201908-555,สามารถ  Detect  ได้  เมื่อมีคลื่นไฟฟ้าหัวใจเปลี่ยน,,1.48,3,เข้าใจ,ทำได้,เสนอแนะ,พัฒนา ,สอนงาน,,
,5,28,PPSV-201908-555,สามารถอ่าน  และแปลผล  EKG   ที่มี  Arrythemia  ได้  เช่น  AF    A  flutter   VT  VF  ST Elevate   SVT,,1.48,3,เข้าใจ,ทำได้,เสนอแนะ,พัฒนา ,สอนงาน,,
,5,18,PPSV-201908-556,การดูแลต่อเนื่องและใช้กระบวนการตั้งแต่แรกรับจนจำหน่าย,,0.5,2,เข้าใจ,ทำได้,เสนอแนะ,พัฒนา ,สอนงาน,,
,5,18,PPSV-201908-556,การปฏิบัติการพยาบาล (Nursing Implementation) - การบันทึกทางการพยาบาลตามนโยบาย,,0.5,2,เข้าใจ,ทำได้,เสนอแนะ,พัฒนา ,สอนงาน,,
,5,18,PPSV-201908-556,การปฏิบัติการพยาบาล (Nursing Implementation) - การปฏิบัติการพยาบาลตามแผน,,0.5,2,เข้าใจ,ทำได้,เสนอแนะ,พัฒนา ,สอนงาน,,
,5,18,PPSV-201908-556,การปฏิบัติตามจรรยาบรรณวิชาชีพและการปฏิบัติตามสิทธิผู้ป่วย,,0.5,2,เข้าใจ,ทำได้,เสนอแนะ,พัฒนา ,สอนงาน,,
,5,18,PPSV-201908-556,การประเมินผลการพยาบาล (Nursing Evauation),,0.5,2,เข้าใจ,ทำได้,เสนอแนะ,พัฒนา ,สอนงาน,,
,5,18,PPSV-201908-556,การประเมินภาวะสุขภาพ (Health Assessment) - การเก็บรวบรวมข้อมูล,,0.5,2,เข้าใจ,ทำได้,เสนอแนะ,พัฒนา ,สอนงาน,,
,5,18,PPSV-201908-556,การประเมินภาวะสุขภาพ (Health Assessment) - การวิเคราะห์ข้อมูล,,0.5,2,เข้าใจ,ทำได้,เสนอแนะ,พัฒนา ,สอนงาน,,
,5,18,PPSV-201908-556,การประสานงานร่วมกันกับทีมสหสาขาวิชาชีพ,,0.5,2,เข้าใจ,ทำได้,เสนอแนะ,พัฒนา ,สอนงาน,,
,5,18,PPSV-201908-556,การวางแผนการพยาบาล (Nursing Planning) - เกณฑ์การประเมินผลการพยาบาล,,0.5,2,เข้าใจ,ทำได้,เสนอแนะ,พัฒนา ,สอนงาน,,
,5,18,PPSV-201908-556,การวางแผนการพยาบาล (Nursing Planning) - การกำหนดเป้าหมายของการพยาบาล,,0.5,2,เข้าใจ,ทำได้,เสนอแนะ,พัฒนา ,สอนงาน,,
,5,18,PPSV-201908-556,การวางแผนการพยาบาล (Nursing Planning) - การกำหนดกิจกรรมการพยาบาล,,0.5,2,เข้าใจ,ทำได้,เสนอแนะ,พัฒนา ,สอนงาน,,
,5,18,PPSV-201908-556,การวางแผนการพยาบาล (Nursing Planning) - การจัดลำดับความสำคัญของปัญหา,,0.5,2,เข้าใจ,ทำได้,เสนอแนะ,พัฒนา ,สอนงาน,,
,5,18,PPSV-201908-556,การวินิจฉัยการพยาบาล (Nursing Diagnosis) -การกำหนดข้อมูลสนับสนุน,,0.5,2,เข้าใจ,ทำได้,เสนอแนะ,พัฒนา ,สอนงาน,,
,5,18,PPSV-201908-556,การวินิจฉัยการพยาบาล (Nursing Diagnosis) -การกำหนดข้อวินิจฉัยทางการพยาบาล,,0.5,2,เข้าใจ,ทำได้,เสนอแนะ,พัฒนา ,สอนงาน,,
,5,31,PPSV-201908-556,การเคาะปอดก่อน Suction ถูกต้อง,,1.2,2,เข้าใจ,ทำได้,เสนอแนะ,พัฒนา ,สอนงาน,,
,5,31,PPSV-201908-556,การจัดท่าของผู้ป่วยในการ Suction ถูกต้อง,,1.2,2,เข้าใจ,ทำได้,เสนอแนะ,พัฒนา ,สอนงาน,,
,5,31,PPSV-201908-556,ความรู้ในการประเมินอาการผู้ป่วย,,1.2,2,เข้าใจ,ทำได้,เสนอแนะ,พัฒนา ,สอนงาน,,
,5,31,PPSV-201908-556,จัดเตรียมอุปกรณ์ Suction ครบถ้วนถูกต้อง,,1.2,2,เข้าใจ,ทำได้,เสนอแนะ,พัฒนา ,สอนงาน,,
,5,31,PPSV-201908-556,มีความรู้เกี่ยวกับการ Suction ในเด็ก,,1.2,2,เข้าใจ,ทำได้,เสนอแนะ,พัฒนา ,สอนงาน,,
,5,31,PPSV-201908-556,วิธีการ Suction ตามหลัก Aseptic technique,,1.2,2,เข้าใจ,ทำได้,เสนอแนะ,พัฒนา ,สอนงาน,,
,5,25,PPSV-201908-556,Hand Hygiene ความรู้และการปฏิบัติล้างมือได้ถูกต้องตามนโยบาย (5 moment 7 step),,0.5,2,เข้าใจ,ทำได้,เสนอแนะ,พัฒนา ,สอนงาน,,
,5,25,PPSV-201908-556,การจัดการขยะติดเชื้อ   อธิบายประเภทของขยะได้ และสามารถแยกทิ้งขยะได้ถูกต้อง,,0.5,2,เข้าใจ,ทำได้,เสนอแนะ,พัฒนา ,สอนงาน,,
,5,25,PPSV-201908-556,การจัดการของ sterile รู้วิธีการจัดการกับอุปกรณ์ปราศจากเชื้อใกล้วันหมดอายุ การจัดเรียง First in first out และการใช้ตามหลัก aseptic technique,,0.5,2,เข้าใจ,ทำได้,เสนอแนะ,พัฒนา ,สอนงาน,,
