ค่าว่าง,กำหนด 2,ชื่อ FC,สถานะ,
,2,กระบวนการพยาบาล,Y,
,2,การช่วยชีวิตและภาวะวิกฤติ,Y,
,2,การบริหารยา,Y,
,2,การบริหารสารน้ำ,Y,
,2,การบริหารเลือด,Y,
,2,การจัดการกับความเจ็บปวด,Y,
,2,การดูแลภาวะโภชนาการ,Y,
,2,การควบคุมและป้องกันการติดเชื้อ,Y,
,2,ความรู้ในการดูแลผู้ป่วยตาม Bundle of care : VAP & HAP,Y,
,2,ความสามารถในการใช้เครื่อง Defibrillator,Y,
,2,ความสามารถในการอ่านและแปลผล EKG,Y,
,2,ความรู้ในการดูแลผู้ป่วย  กลุ่ม  Acute  MI,Y,
,2,การดูแลผู้ป่วยเด็กที่มีอาการชัก,Y,
,2,การ Suction ผู้ป่วยเด็ก,Y,
,2,การเตรียมเครื่องมือช่วยแพทย์,Y,
,2,การช่วยชีวิตขั้นพื้นฐาน,Y,
,2,การดูแลสุขอนามัยของผู้ป่วย,Y,
,2,การสื่อสารประสานงาน,Y,
,2,การใช้ระบบ HIS ในโรงพยาบาล,Y,
,2,การประเมินผู้ป่วยโรคหัวใจ,Y,
,2,หัตถการฉีดสีตรวจสวนหัวใจ,Y,
,2,การรับผู้ป่วยและส่งมอบผลตรวจ,Y,
,2,การดูแลผู้ป่วย,Y,
,2,การตรวจเทคโนโลยีหัวใจและทรวงอก,Y,
,2,เครื่องมือทางเทคโนโลยีหัวใจฯ,Y,
,2,การนัดหมายและเตรียมความพร้อม,Y,
,2,วิชาชีพเทคโนโลยีหัวใจและทรวงอก,Y,
,2,การ Triage,Y,
,2,การดูแลผู้ป่วยเบาหวาน,Y,
,2,การดูแลผู้ป่วยโรคสมอง,Y,
,2,การเป็นเลขาแพทย์หน้าห้องตรวจ,Y,
,2,การช่วยแพทย์ทำหัตถการ,Y,
,2,การป้องกันภาวะชักจากไข้สูง,Y,
,2,การช่วยแพทย์เจาะก้อนที่คอ,Y,
,2,การเช็ดตัวลดไข้,Y,
,2,การเตรียมผู้ป่วยผ่าตัด,Y,
,2,การเตรียมผ่าตัดฝัน,Y,
,2,ภาวะฉุกเฉินระหว่างการตั้งครรภ์,Y,
,2,การประเมินหญิงตั้งครรภ์,Y,
,2,การตรวจภายใน/มะเร็งปากมดลูก,Y,
,2,การเจาะน้ำคร่ำ,Y,
,2,การผ่าฝี/ฝ่าต่อมบาโทลิน,Y,
,2,การตรวจ ultrasound,Y,
,2,การฝังยาคุมกำเนิด,Y,
,2,การเตรียมผู้ป่วยผ่าตัด หัตถการ,Y,
,2,การส่งผู้ป่วยตรวจพิเศษต่างๆ,Y,
,2,การดูแลผู้ป่วยผ่าตัดเปลี่ยนข้อเทียม ตามCare Map,Y,
,2,การประเมินผู้ป่วย Stroke,Y,
,2,การประเมินผู้ป่วยโรคหัวใจและหลอดเลือด,Y,
,2,หัตถการส่องกล้องทางเดินอาหาร,Y,
,2,ผู้ป่วยGastroscopy&Colonoscopy,Y,
,2,การช่วยแพทย์ทำหัตถการ,Y,
,2,การเตรียมเครื่องมือส่องกล้องฯ,Y,
,2,การประเมินก่อน-หลังผ่าตัดคลอด,Y,
,2,แบบประเมินภาวะตกเลือดหลังคลอด,Y,
,2,การประเมินผู้ป่วยต้อกระจก,Y,
,2,การเตรียมผู้ป่วยผ่าตัดคลอด,Y,
,2,การเตรียมผู้ป่วยโดยทั่วไป,Y,
,2,การพยาบาลผู้ป่วยเจาะปอด,Y,
,2,การพยาบาลผู้ป่วยผ่าตัดไส้ติ่ง,Y,
,2,เครื่องมือใส่ท่อระบายทรวงอก,Y,
,2,การเตรียมผู้ป่วยผ่าตัด,Y,
,2,การพยาบาลผู้ป่วย DM,Y,
,2,การพยาบาลผู้ป่วย CVA,Y,
,2,การเตรียมตรวจทางรังสีวินิจฉัย,Y,
,2,การเตรียมทำการเจาะปอด,Y,
,2,การช่วยแพทย์ทำหัตถการเจาะท้อง,Y,
,2,การพยาบาลผู้ป่วยโรคหัวใจ,Y,
,2,เตรียมเครื่องมือเจาะปอด,Y,
,2,เตรียมเครื่องมือเจาะหลัง,Y,
,2,การเตรียมอุปกรณ์ทำแผล,Y,
,2,เตรียมเครื่องมือเจาะท้อง,Y,
,2,การเตรียมเครื่องมือช่วยแพทย์,Y,
,2,การเช็ดตัวลดไข้,Y,
,2,การเตรียมอุปกรณ์สำหรับ suction,Y,
,2,การช่วยผ่าตัดคลอดLT C/S (ON.),Y,
,2,การช่วยทำผ่าตัดผ่านกล้อง(ON.),Y,
,2,การช่วยทำผ่าตัดไส้ติ่ง(ON.),Y,
,2,เตรียมเครื่องมือผ่าตัดไส้ติ่ง,Y,
,2,เครื่องมือผ่าตัดผ่านกล้อง,Y,
,2,เตรียมเครื่องมือผ่าตัดคลอด,Y,
,2,ความรู้เรื่องโรคไตวายเฉียบพลัน,Y,
,2,หัตถการ On Double Lumen Catheter,Y,
,2,การดูแลผู้ป่วยฟอกเลือด,Y,
,2,การเตรียมตัวกรองสำหรับฟอกเลือด,Y,
,2,การล้างตัวกรองสำหรับฟอกเลือด,Y,
,2,บริการตรวจสุขภาพนอกสถานที่,Y,
,2,การแปลผลตรวจสุขภาพต่างๆ,Y,
,2,การให้คำปรึกษาด้านสุขภาพ และ วัคซีน,Y,
,2,การเจาะเลือดและเก็บสิ่งส่งตรวจ,Y,
,2,ทักษะในการจำแนกลูกค้า ,Y,
,2,การจัดทำรายงานผลตรวจสุขภาพบริษัท,Y,
,2,ศัพท์ทางการแพทย์,Y,
,2,การเรียบเรียงภาษา,Y,
,2,โปรแกรมตรวจสุขภาพต่างๆ,Y,
,2,ทักษะในการขายโปรแกรมตรวจสุขภาพ,Y,
,2,ทักษะการสื่อสารและประสานงาน,Y,
,2,การคีย์โปรแกรม   รายการตรวจต่างๆ,Y,
,2,การเป็นเลขาแพทย์หน้าห้องตรวจ,Y,
,2,การเก็บและนำส่งสิ่งส่งตรวจ,Y,
,2,ทักษะในการทำหัตถการต่างๆ,Y,
,2,งานด้านการควบคุมและป้องกันการติดเชื้อ,Y,
,2,การทำความสะอาดให้ปราศจากเชื้อ,Y,
,2,การประเมินใบสั่งยา,Y,
,2,การแนะนำและให้คำปรึกษาด้านยา,Y,
,2,อาการไม่พึงประสงค์จากการใช้ยา,Y,
,2,การจัดเก็บและควบคุมคุณภาพยา,Y,
,2,ทักษะในการให้บริการเภสัชกรรม,Y,
,2,การจัดยาและเวชภัณฑ์,Y,
,2,การตรวจสอบและวิเคราะห์ใบสั่งยา,Y,
,2,การบริหารคลังยาและเวชภัณฑ์,Y,
,2,ผู้ป่วยที่เข้าตรวจทางรังสี,Y,
,2,การถ่ายภาพทางรังสี,Y,
,2,การบำรุงรักษาเครื่องมือรังสี,Y,
,2,การป้องกันอันตรายจากรังสี,Y,
,2,การเตรียมความพร้อมในการบริการ,Y,
,2,การควบคุมคุณภาพภาพถ่ายทางรังสี,Y,
,2,วิชาชีพรังสีเทคนิค,Y,
,2,การบริหารยา,Y,
,2,การบริหารสารน้ำ,Y,
,2,การบริหารเลือด,Y,
,2,การควบคุมและป้องกันการติดเชื้อ,Y,
,2,กระบวนการพยาบาล,Y,
,2,การประเมินภาวะวิกฤติ,Y,
,2,การตรวจทางรังสี,Y,
,2,ความสงบระดับกลาง,Y,
,2,คุณภาพผลการตรวจวิเคราะห์,Y,
,2,ทักษะการเก็บสิ่งส่งตรวจ,Y,
,2,การตรวจวิเคราะห์สิ่งส่งตรวจ,Y,
,2,การรายงานผลการตรวจวิเคราะห์,Y,
,2,การบำรุงรักษาและใช้เครื่องมือ,Y,
,2,ทักษะการเตรียมสิ่งส่งตรวจ,Y,
,2,การจัดเก็บสิ่งส่งตรวจวันอื่น,Y,
,2,การบำรุงรักษาและใช้เครื่องมือ,Y,
,2,การตรวจรับ Request ผ่านระบบ,Y,
,2,ทักษะการเก็บสิ่งส่งตรวจ,Y,
,2,การใช้โปรแกรม Microsoft office,Y,
,2,การตรวจประเมินทางกายภาพบำบัด,Y,
,2,การบันทึกข้อมูลทางกายภาพบำบัด,Y,
,2,เครื่องมือทางกายภาพบำบัด,Y,
,2,ความรู้ด้านการทดสอบสมรรถภาพปอด,Y,
,2,การสร้างสัมพันธภาพ,Y,
,2,การตรวจประเมินทางกิจกรรมบำบัด,Y,
,2,การบันทึกข้อมูลทางกิจกรรมบำบัด,Y,
,2,อุปกรณ์ทางกิจกรรมบำบัด,Y,
,2,ความรู้ด้านการตรวจพัฒนาการเด็ก,Y,
,2,การให้บริการที่ดี,Y,
,2,ความพร้อมทางกายภาพบำบัด/กิจกรรมบำบัด,Y,
,2,การช่วยรักษาทางกายภาพบำบัด/กิจกรรมบำบัด,Y,
,2,การรักษาอุปกรณ์ทางกายภาพบำบัด/กิจกรรมบำบัด,Y,
,2,ความรู้ด้านโภชนาการและโภชนบำบัดเฉพาะโรค,Y,
,2,การให้บริการด้านโภชนศาสตร์คลินิก,Y,
,2,มาตรฐานสุขาภิบาลอาหาร,Y,
,2,การปรุงอาหารผู้ป่วย และอาหารบุคคลทั่วไป,Y,
,2,การบริการอาหารผู้ป่วย,Y,
,2,การจัดการลูกค้าสัมพันธ์,Y,
,2,ทักษะการใช้ Computer ระบบ HIS,Y,
,2,การเบิกค่ารักษาพยาบาล,Y,
,2,ความรู้ศัพท์แพทย์/โรคเบื้องต้น,Y,
,2,การจัดการลูกค้าสัมพันธ์,Y,
,2,ทักษะการใช้ Computer ระบบ HIS,Y,
,2,การให้รหัสโรครหัสหัตถการ,Y,
,2,ความรู้ศัพท์แพทย์เบื้องต้น,Y,
,2,พรบ.ข่าวสารทางราชการพ.ศ.2540,Y,
,2,มาตรฐานการบันทึกเวชระเบียน,Y,
,2,การจัดเรียงเวชระเบียน,Y,
,2,ความสมบูรณ์ของเวชระเบียน,Y,
,2,การค้น-เก็บเวชระเบียน,Y,
,2,การค้น-เก็บเวชระเบียน,Y,
,2,การเคลื่อนย้ายผู้ป่วย,Y,
,2,การใช้วิทยุสื่อสาร,Y,
,2,การฟื้นคืนชีพเบื้องต้น BLS,Y,
,2,การปฏิบัติเกี่ยวกับCODEฉุกเฉิน,Y,
,2,งาน รับ-ส่งยาขึ้น  WARD,Y,
,2,ศัพท์แพทย์เบื้องต้น,Y,
,2,เงื่อนไขกรมธรรม์/สิทธิเบิก,Y,
,2,การใช้ทรัพยากรสุขภาพ,Y,
,2,การตรวจสอบสิทธิการเบิก,Y,
,2,การเบิกรักษาพยาบาลกับหน่วยงาน,Y,
,2,พรบ.คุ้มครองผู้ประสบภัยจากรถ,Y,
,2,ความรู้ศัพท์แพทย์/โรคเบื้องต้น,Y,
,2,ทักษะการใช้ Computer ระบบ HIS,Y,
,2,ความรู้ระบบงานโอเปอเรเตอร์,Y,
,2,การใช้วิทยุสื่อสารและประสานงาน,Y,
,2,การควบคุมสัญญาณ Alarm,Y,
,2,การสื่อสารภาษาอังกฤษเบื้องต้น,Y,
,2,ความรู้เกี่ยวกับศัพท์แพทย์,Y,
,2,ทักษะการให้คำปรึกษาปัญหาสุขภาพ,Y,
,2,บริการทางการแพทย์ของโรงพยาบาล,Y,
,2,การควบคุมและป้องกันการติดเชื้อ,Y,
,2,การใช้หลักฐานเชิงประจักษ์,Y,
,2,กระบวนการพัฒนาคุณภาพ (CQI),Y,
,2,ทักษะในการให้ความรู้,Y,
,2,ความรู้และทักษะในระบบคุณภาพ,Y,
,2,โปรแกรมการพัฒนาคุณภาพ,Y,
,2,การจัดการสารเคมี /ขยะอันตราย,Y,
,2,การแก้ไขและป้องกันภาวะฉุกเฉิน,Y,
,2,การจัดทำฐานข้อมูล ทางสถิติ ถูกต้องตรงเวลา ,Y,
,2,ความรู้เรื่องระบบการบริหารความเสี่ยง,Y,
,2,ทักษะการสื่อสารและประสานงาน,Y,
,2,ทักษะการจัดทำเอกสารแต่ละระดับ,Y,
,2,ความรอบคอบในการจัดทำเอกสาร,Y,
,2,การเป็นผู้ตรวจติดตามคุณภาพ,Y,
,2,ทักษะการสื่อสารและประสานงาน,Y,
,2,การวางแผนสำรวจสถานการณ์ตลาด,Y,
,2,ความรู้เกี่ยวกับโรงพยาบาล สุขภาพและเครื่องมือแพทย์,Y,
,2,การใช้โปรแกรม  Microsoft Office,Y,
,2,การทำกิจกรรมส่งเสริมการขาย,Y,
,2,การประชาสัมพันธ์โรงพยาบาล,Y,
,2,การเขียนโครงการด้านการตลาด,Y,
,2,การให้คำปรึกษา,Y,
,2,การสร้างเสริมสุขภาพ,Y,
,2,การบริหารจัดการวัคซีน,Y,
,2,การบริการ,Y,
,2,การจัดโปรแกรมเพื่อสุขภาพ,Y,
,2,การทดสอบสมรรถภาพทางกาย,Y,
,2,การควบคุมสื่อประชาสัมพันธ์ทางการตลาด,Y,
,2,การใช้ข้อมูลสถิติในการวิเคราะห์วางแผนจัดทำสื่อประชาสัมพันธ์,Y,
,2,โปรแกรมออกแบบสื่อสิ่งพิมพ์,Y,
,2,การใช้โปรแกรมตัดต่อวีดีโอ,Y,
,2,การใช้กล้องถ่ายภาพ,Y,
,2,ทักษะในการขายโปรแกรมตรวจสุขภาพ,Y,
,2,ทักษะการสื่อสารและประสานงาน,Y,
,2,ความรู้ด้านการส่งเสริมสุขภาพ,Y,
,2,การควบคุมกระบวนการทำงาน,Y,
,2,การบริหารจัดการผ้า,Y,
,2,การให้บริการการรักษาความปลอดภัย,Y,
,2,การบริการความสะอาดประเภทต่างๆ,Y,
,2,การบริหารจัดการทรัพย์สิน,Y,
,2,อุปกรณ์ป้องกันอันตราย (PPE),Y,
,2,การเก็บ - ส่งผ้าซัก,Y,
,2,การจัดการผ้าเปื้อนของโรงพยาบาล,Y,
,2,การป้องกันการแพร่กระจายเชื้อ,Y,
,2,การคัดแยกขยะประเภทต่างๆ,Y,
,2,การจราจรและพื้นที่จอดรถของรพ.,Y,
,2,การใช้อุปกรณ์ดับเพลิงและสัญญาณแจ้งเหตุเพลิงไหม้,Y,
,2,การดูแลกล้องวงจรปิด,Y,
,2,การใช้อุปกรณ์ป้องกันอันตราย,Y,
,2,ทักษะการสื่อสารประสานงาน,Y,
,2,ความรู้เรื่องการตัดเย็บ,Y,
,2,การคำนวณผ้าที่ต้องตัดเย็บ,Y,
,2,การสร้างแบบงานที่ต้องตัดเย็บ,Y,
,2,ความรู้เรื่องการพับผ้า,Y,
,2,การประเมินและช่วยเหลือผู้ป่วย,Y,
,2,ความสามารถในการขับขี่ยานพาหนะ,Y,
,2,การตรวจเช็คความพร้อมในการใช้รถ,Y,
,2,ทักษะในการใช้วิทยุสื่อสาร,Y,
,2,เส้นทางในกรุงเทพและต่างจังหวัด,Y,
,2,การบำรุงรักษางานระบบไฟฟ้าและสื่อสาร,Y,
,2,การบำรุงรักษางานระบบปรับอากาศและระบายอากาศ,Y,
,2,การบำรุงรักษางานระบบสุขาภิบาลและป้องกันอัคคีภัย,Y,
,2,การบำรุงรักษางานโครงสร้าง สถาปัตยกรรม และงานตกแต่งภายใน,Y,
,2,การใช้อุปกรณ์ป้องกันอันตราย,Y,
,2,วัสดุ อุปกรณ์ทางการช่าง,Y,
,2,ทักษะการสื่อสาร ประสานงาน,Y,
,2,วัสดุ อุปกรณ์ ในงานซ่อมบำรุง,Y,
,2,ทักษะการใช้ Computer,Y,
,2,คลังวัสดุ อุปกรณ์ซ่อมบำรุง,Y,
,2,การจัดการข้อมูลเอกสาร,Y,
,2,วัสดุ อุปกรณ์ ควบคุมค่าใช้จ่าย จัดทำรายงานโครงการปรับปรุงพื้นที่,Y,
,2,ทักษะการวางแผน การบริหารจัดการโครงการปรับปรุงพื้นที่ เบื้องต้น,Y,
,2,ทักษะในการสื่อสาร ติดต่อประสานงาน หน่วยงานต่าง ๆ ทั้งภายนอกและภายใน,Y,
,2,การจัดการข้อมูลเอกสาร ต่าง ๆ เช่น สัญญาก่อสร้าง ส่งมอบ รับมอบงาน วาระการประชุม เป็นต้น,Y,
,2,มาตรฐานเครื่องมือแพทย์  (JCI. FMS.8),Y,
,2,เครื่องมือและอุปกรณ์การแพทย์,Y,
,2,ความปลอดภัยของไฟฟ้าทางการแพทย์,Y,
,2,ระบบแก๊สทางการแพทย์,Y,
,2,การสอบเทียบและการบำรุงรักษาเครื่องมือแพทย์,Y,
,2,บริหารคลังสินค้างานซ่อมบำรุง,Y,
,2,การจัดการข้อมูลเอกสาร,Y,
,2,ความรู้เรื่องสุขอนามัยส่วนบุคคลและมาตรฐานสุขาภิบาลอาหาร,Y,
,2,ความรู้เรื่องข้อมูลสารเคมีและ (MSDS)ที่มี ในห้องอาหาร,Y,
,2,ความรู้เกี่ยวกับอุปกรณ์ป้องกันอันตรายส่วนบุคคล (PPE),Y,
,2,ความรู้เรื่องการสั่งซื้อ ตรวจรับทำความสะอาด จัดเก็บ-จ่าย อาหารสดอาหารแห้ง,Y,
,2,ความรู้เรื่องการจัดทำบัญชีเบื้องต้นและความสามารถในการรับชำระเงิน,Y,
,2,ความรู้เรื่องการปรุงอาหารบุคคลทั่วไปและอาหาร ผู้ป่วย,Y,
,2,ความรู้เรื่องการล้าง จัดเก็บ ภาชนะอุปกรณ์ ตามมาตรฐานสุขาภิบาลอาหาร,Y,
,2,ความรู้เรื่องการจัดอาหาร การนำส่งและจ่ายอาหารบนหอผู้ป่วย,Y,
,2,การใช้โปรแกรมสั่งซื้อสินค้า,Y,
,2,การสรรหา - คัดเลือกผู้ขาย,Y,
,2,ทักษะการเจรจาต่อรอง,Y,
,2,การจัดซื้อ - จัดจ้าง,Y,
,2,การแก้ไขปัญหาในการทำงาน,Y,
,2,ระบบการบริหารจัดการคลังสินค้า,Y,
,2,รายละเอียดผลิตภัณฑ์สินค้า,Y,
,2,ขั้นตอน วิธีปฏิบัติงานพัสดุ,Y,
,2,การใช้โปรแกรม HIS,Y,
,2,การบริหารงานบุคคล,Y,
,2,ทักษะการใช้ HCM ,Y,
,2,ทักษะการใช้ Computer,Y,
,2,กฎหมายแรงงาน ระเบียบและสวัสดิการพนักงาน,Y,
,2,การจัดทำรายงาน การวิเคราะห์ข้อมูล การนำเสนอผลงาน,Y,
,2,กฎระเบียบ ข้อบังคับในการทำงาน,Y,
,2,การพัฒนาฝึกอบรม และระบบการบริหารผลงาน,Y,
